textID,text,question,answer,questionType,word_count,word_avg,word_hard,length,Cluster,Difficulty_Level
17757,"힘찬이는 버스에 올랐어요. “엄마, 다녀오겠습니다!” “그래, 잘 다녀오렴.”",버스가 오자 힘찬이는 어떻게 했나요?,버스에 오르고 엄마에게 인사를 했어요.,PT03,8.0,2.0,2.0,43.0,2,2
40248,"“5층으로 빨리 사다리를 올려 줘!” 끼이잉, 철컥! 굴절 사다리차에서 기다란 사다리가 쭉쭉! 소방관이 사다리를 타고 올라가 무사히 토끼 제빵사를 구했어.",기다란 사다리는 어디에서 나왔나요?,굴절 사다리차에서 쭉쭉 나왔어요.,PT03,20.0,1.0,1.0,86.0,2,2
40248,"“5층으로 빨리 사다리를 올려 줘!” 끼이잉, 철컥! 굴절 사다리차에서 기다란 사다리가 쭉쭉! 소방관이 사다리를 타고 올라가 무사히 토끼 제빵사를 구했어.",토끼 제빵사를 어떻게 무사히 구했나요?,소방관이 사다리를 타고 올라갔어요.,PT03,20.0,1.0,1.0,86.0,2,2
17756,"그러자 엄마가 힘찬이를 붙잡았어요. ""어머, 버스가 멈춘 뒤에 차례차례 타야지. 그렇게 갑자기 뛰어들면 다친단다!"" ""네, 엄마!""",엄마가 힘찬이를 붙잡은 이유는 무엇인가요?,갑자기 뛰어들면 다치기 때문이에요.,PT03,16.0,3.5,4.0,73.0,2,2
40246,"왱왱! 비상벨이 울렸어. 소방관들은 먼저 방화복을 후다닥! 입고, 다음에 커다란 헬멧을 척! 쓰고, 그다음에 안전 장갑을 착! 끼고, 재빨리 소방차로 달려갔어!",소방관들은 방화복과 헬멧과 안전 장갑을 착용하고 무엇을 했나요?,재빠르게 소방차로 달려갔어요.,PT03,21.0,2.3333333333333335,3.0,89.0,2,2
40243,셋째 구조 버스가 부릉부릉! 둘째 구급차가 앵앵! 첫째 지휘차가 쌩쌩! 애앵! 애앵! 사이렌이 울리자 도로 위를 달리던 자동차들이 모두 재빨리 길을 비켜 줘.,"사이렌이 울리자, 달리던 자동차들이 어떻게 했나요?",사이렌 소리를 듣고 모두 재빠르게 길을 비켜줘요.,PT03,23.0,3.6666666666666665,7.0,88.0,2,2
40249,"그런데 갑자기 불이 확 번지기 시작했어. 소방관들은 당황하지 않고 1층, 2층, 3층, 4층, 5층! 위로, 위로 올라갔지. 그리고 활활 타오르는 불길을 향해 촤르륵 물대포를 쐈어!",활활 타오르는 불길을 향해 촤르륵 물대포를 쏴서 어떻게 되었을까요?,불이  꺼졌을 것 같아요.,PT03,25.0,3.0,3.0,101.0,2,2
40536,"고소한 냄새를 맡고 손님들이 한꺼번에 여섯 명이 몰려왔어요. “어서 오세요! 오늘은 모두 공짜랍니다!” 할머니가 소리치자, 손님들은 신이 나서 싱글벙글! 할머니는 반가워서 방글방글!",할머니는 어서 오라며 어떻게 했나요?,오늘은 모두 공짜라고 소리쳤어요.,PT03,22.0,1.0,1.0,101.0,2,2
17778,그때 백곰 요리사가 세 종류의 자석을 가져왔어요. 프라이팬과 냄비와 석쇠가 그려진 자석이었지요. “세 가지 자석 중 한 개를 골라 냉장고에 붙여요.”,자석 중 한개를 골라 어떻게 하라고 했나요?,냉장고에 붙이라고 했어요.,PT03,21.0,2.8,4.0,83.0,2,2
16773,서현이는 아빠 덕분에 자전거를 안전하게 타는 법을 배웠어요. “아빠랑 자전거를 타니까 정말 좋아요.” “그래. 앞으로 더 많이 놀아 주마.”,서현이는 아빠랑 함께 자전거를 타서 기분이 어땠나요?,정말 좋았어요.,PT03,19.0,1.5,2.0,78.0,2,2
18197,서현이는 아빠와 필요한 물품을 적었어요. 그리고 안전 보호 장구를 착용했지요. 보세요! 아빠와 서현이 모두 멋지지요?,안전 보호 장구를 착용한 서현이와 아빠는 어떤가요?,멋져요,PT03,15.0,2.0,3.0,65.0,2,2
17785,백곰 요리사는 씩 웃기만 했어요. 자기만의 비밀이라나요. 그 뒤 백곰 요리사는 아주 바빠졌어요. 바로 ‘기막혀 소스’ 덕분이었지요.,언제부터 백곰 요리사는 아주 바빠졌나요?,기막혀 소스를 만든 그 뒤,PT03,17.0,5.0,5.0,73.0,2,2
17785,백곰 요리사는 씩 웃기만 했어요. 자기만의 비밀이라나요. 그 뒤 백곰 요리사는 아주 바빠졌어요. 바로 ‘기막혀 소스’ 덕분이었지요.,백곰 요리사는 어떤 반응을 보였나요?,비밀을 알려주지 않고 웃기만 했어요.,PT03,17.0,5.0,5.0,73.0,2,2
17370,"“어디 보자, 무슨 맛의 요리를 만들까요?” 백곰 요리사가 친구들에게 물었어요. “땅콩처럼 고소한 요리요!” ",요리사는 친구들에게 무엇을 물어봤나요?,무슨 맛의 요리를 만들지 물어봤어요.,PT03,13.0,2.0,2.0,61.0,2,2
17775,“요리의 맛과 재료는 정해졌고. 이제 어디에 요리할지 정해야 해요. 뭐가 좋을까요?”  ,어디에 요리할 지는 언제 정하나요?,이제 정해요.,PT03,11.0,5.0,5.0,49.0,2,2
17372,"백곰 요리사는 땅콩, 고추, 사탕 그림의 표지판을 세웠어요. “좋아하는 맛의 표지판 앞에 줄을 서세요. 가장 긴 줄의 표지판 맛대로 오늘의 요리를 만들 거예요.”",백곰 요리사는 표지판을 세우고 친구들에게 어떻게 하라고 했나요?,줄을 서라고 했어요.,PT03,23.0,2.25,3.0,90.0,2,2
17373,하지만 친구들은 삐뚤빼뚤 줄을 섰어요. “난 매콤한 맛도 달콤한 맛도 다 좋은데.” 다람쥐는 표지판을 이리 기웃 저리 기웃거렸어요. 코끼리는 두 표지판 사이에 걸쳐 섰고요.,다람쥐는 표지판을 보며 어떤 생각을 했나요?,매콤한 맛과 달콤한 맛이 다 좋다고 생각했어요.,PT03,24.0,2.0,3.0,96.0,2,2
16141,"그때 수철이의 눈에 기차놀이 블록이 눈에 띄었어요. ""삼촌! 이거 사 주세요."" 그런데 삼촌이 상자의 제품 설명서를 꼼꼼하게 살피더니 말씀하셨어요.",삼촌이 상자의 제품 설명서를 꼼꼼하게 살피고 무슨 말씀을 하셨을까요?,이건 아이들에게 해로운 화학성분이 많이 들어있어서 안된다고 하실 것 같아요.,PT03,19.0,3.0,4.0,82.0,2,2
16141,"그때 수철이의 눈에 기차놀이 블록이 눈에 띄었어요. ""삼촌! 이거 사 주세요."" 그런데 삼촌이 상자의 제품 설명서를 꼼꼼하게 살피더니 말씀하셨어요.",수철이는 기차놀이 블록을 누구에게 사달라고 했나요?,삼촌에게 사달라고 했어요.,PT03,19.0,3.0,4.0,82.0,2,2
17780,“자석을 종류별로 정리하면 되지요.” 백곰 요리사는 재빨리 자석들을 가지런히 붙였어요. 자석들 중 가장 줄이 긴 것은 프라이팬이었어요.,백곰 요리사는 자석을 어떻게 했나요?,종류별로 가지런히 정리했어요.,PT03,17.0,2.5,3.0,75.0,2,2
17781,“프라이팬을 고른 친구가 가장 많으니까! 오늘의 요리는 프라이팬에다 하기로 해요.” 백곰 요리사는 커다란 프라이팬을 불 위에 올려놓았어요.,백곰 요리사는 어디에다 요리를 하기로 했나요?,프리이팬에다 하기로 했어요.,PT03,17.0,1.5,2.0,77.0,2,2
17782,"“지금부터 하는 요리의 이름은 내 멋대로 정해도 되겠지요? 뭐가 있을까? 그래, 숲속 별 달달이가 좋겠어!” ",요리의 이름은 어떻게 정했나요?,내 멋대로 정했어요.,PT03,15.0,1.0,1.0,61.0,2,2
16140,"삼촌의 말에 수철이는 신이 났어요. 장난감 가게에 들어선 수철이는 장난감을 고르기 시작했어요. 곰 인형, 자동차, 로봇, 블록! 모두 다 갖고 싶어요.",장난감 가게에 들어선 수철이는 어떻게 행동했나요?,신이 나서 장난감을 골랐어요.,PT03,21.0,1.0,1.0,84.0,2,2
17791,동그란 쿠키가 더 많을까요? 네모난 쿠키가 더 많을까요? 쿠키의 수를 세어 보고 그 수만큼 그래프에 색을 칠해 보아요.,쿠키의 수만큼 무엇을 하나요?,그래프에 색을 칠해요.,PT03,18.0,2.0,2.0,66.0,2,2
16769,"서현이는 아빠와 공원 입구의 횡단보도에 다다랐어요. “여기서부터는 내려서 자전거를 끌고 걸어야 해.” “네, 아빠.”",아빠는 서현이에게 횡단보도에서는 어떻게 해야 한다고 했나요?,자전거에서 내려서 자전거를 끌고 걸어야 한다고 했어요.,PT03,14.0,1.0,1.0,65.0,2,2
17771,“이제 요리 재료를 정해야 해요. 어떤 재료가 좋을까요?” 백곰 요리사가 물었어요.,백곰 요리사는 요리 하기 전에 뭐라고 했나요?,어떤 재료가 좋을지 물었어요.,PT03,11.0,2.0,2.0,46.0,2,2
17772,다람쥐와 토끼도 소리쳤어요. “펄떡이는 물고기요!” 여우 남매도 말했지요.,다람쥐와 토끼는 어떻게 말했나요?,소리를 쳤어요.,PT03,8.0,1.0,1.0,41.0,2,2
18196,"오늘은 즐거운 주말이에요. 서현이는 아빠와 함께 공원에서 자전거를 타기로 했어요. “서현아, 엄마가 도시락 싸 주시는 동안 아빠랑 안전 보호 장구를 챙길까?” “좋아요!”",주말인 오늘 서현이의 기분은 어떤가요?,즐겁고 좋아요.,PT03,22.0,2.0,3.0,95.0,2,2
18196,"오늘은 즐거운 주말이에요. 서현이는 아빠와 함께 공원에서 자전거를 타기로 했어요. “서현아, 엄마가 도시락 싸 주시는 동안 아빠랑 안전 보호 장구를 챙길까?” “좋아요!”",엄마가 도시락을 싸주시는 동안 서현이는 아빠랑 무엇을 했나요?,안전 보호 장구를 챙겼어요.,PT03,22.0,2.0,3.0,95.0,2,2
16772,"“내리막길에서는 이렇게 자전거에서 내려서 가야 해. 넘어지거나 사람을 칠 수도 있단다.” “네, 아빠.”",내리막길에서는 왜 자전거에서 내려서 가야 하나요?,넘어지거나 사람을 칠 수도 있어서,PT03,13.0,4.0,4.0,58.0,2,2
2403,"후욱 세게 불면,동글동글 작은 비눗방울. 후우우 살며시 불면,둥글둥글 커다란 비눗방울. “더 크게 더 크게나만큼 커다랗게 만들어야지.”",세게 불면 어떤 모양의 비눗방울이 만들어지나요?,동글동글 작은 비눗방울이 만들어져요.,PT03,16.0,2.0,2.0,75.0,2,2
2401,곰곰이의 머리 위로 동그란 방울이 살랑살랑 내려왔어요. “이게 뭐야? 비가 방울방울 내리네. “이건 비눗방울이야.나랑 같이 비눗방울 놀이 할래?,동그란 방울을 보고 곰곰이가 뭐라고 했나요?,비가 내린다고 했어요.,PT03,18.0,1.5,3.0,80.0,2,2
2401,곰곰이의 머리 위로 동그란 방울이 살랑살랑 내려왔어요. “이게 뭐야? 비가 방울방울 내리네. “이건 비눗방울이야.나랑 같이 비눗방울 놀이 할래?,나는 곰곰이와 무엇을 하며 놀았을까요?,비눗방울 놀이를 하며 놀 것 같아요.,PT03,18.0,1.5,3.0,80.0,2,2
2407,비눗방울에 곰곰이와 다람이가 비쳤어요. 동그란 비눗방울이 반짝반짝 아롱아롱. 바람을 타고 하늘 높이 동동동! 그때 곰곰이가 좋아하는 꿀단지가 비눗방울에 비쳤어요.,꿀단지가 비눗방울에 비쳤을 때 곰곰이 기분은 어땠을까요?,너무 좋았을 것 같아요.,PT03,19.0,1.6666666666666667,3.0,90.0,2,2
2407,비눗방울에 곰곰이와 다람이가 비쳤어요. 동그란 비눗방울이 반짝반짝 아롱아롱. 바람을 타고 하늘 높이 동동동! 그때 곰곰이가 좋아하는 꿀단지가 비눗방울에 비쳤어요.,꿀단지가 비눗방울에 비쳤을 때 곰곰이는 어떻게 했을까요?,잡으려고 하다 비눗방울을 터트리게 될 것 같아요.,PT03,19.0,1.6666666666666667,3.0,90.0,2,2
16770,"공원에 도착한 서현이는 콩닥콩닥 마음이 들떴어요. “서현아, 핸들은 양손으로 꼭 잡고 타야 해. 알지?” “그럼요! 빨리 타요, 아빠.”",아빠는 서현이에게 자전거를 어떻게 타야 한다고 했나요?,양손으로 핸들을 꼭 잡고 타야 한다고 했어요.,PT03,18.0,3.3333333333333335,7.0,76.0,2,2
18197,서현이는 아빠와 필요한 물품을 적었어요. 그리고 안전 보호 장구를 착용했지요. 보세요! 아빠와 서현이 모두 멋지지요?,서현이와 아빠는 필요한 물품을 적고 무엇을 했나요?,안전 보호 장구를 착용했어요.,PT03,15.0,2.0,3.0,65.0,2,2
1381,"그렇게 먼 길을 새끼 얼룩말도 같이 갈 수 있다고? 새끼 얼룩말은 튼튼하거든.  태어나서 얼마 뒤에 아장아장 걷고, 몇 시간이 지나면 달각달각 뛰지.",얼룩말은 태어난 다음 날 어떻게 돌아다닐까요?,걷기도 하고 뛰기도 하며 다닐 거예요.,PT03,22.0,2.25,4.0,83.0,2,2
1681,할아버지는 싹이 난 볍씨를 모판에 솔솔 뿌리고 부드러운 흙으로 덮어 주었어요. 싹은 점점 길게 자라났지요. “모가 한 뼘쯤 자랐으니 모내기를 해야겠네.” ,모가 한 뼘쯤 자라나면 무엇을 해야 하나요?,모내기를 해야 해요.,PT03,21.0,4.333333333333333,6.0,86.0,2,2
1390,"저기, 콧구멍만 벌름거리며 숨어 있는 게 뭐야? 으악! 악어잖아! 악어가 있다고 두려워해서는 안 돼. 후다닥 재빨리 헤엄쳐 가면 악어도 피할 수 있어.",얼룩말은 악어를 보며 어떤 감정을 느끼나요?,두려운 마음이 들 것 같아요.,PT03,22.0,2.6666666666666665,3.0,84.0,2,2
2187,"시끄럽고 귀찮은 파리, 벌레잡이 식물들에게 부탁해야겠다. 벌레잡이 식물들아, 파리들을 잡아 줘. 이렇게 무서운 식물들이 있다 니! 도망가자, 도망가.",파리들은 벌레잡이 식물을 어떻게 느끼나요?,무서워서 도망가려고 해요.,PT03,18.0,2.5,4.0,83.0,2,2
2182,내 이름은 파리지옥. 가시처럼 난 긴 털이 무섭지? 나는 잎 안쪽에 아주아주 짧은 털을 숨겨 놓았어. 파리가 그 털 위에 앉으면. ,파리지옥의 가시같은 긴 털은 어떻게 보이나요?,무서워 보여요.,PT03,21.0,4.333333333333333,6.0,73.0,2,2
2182,내 이름은 파리지옥. 가시처럼 난 긴 털이 무섭지? 나는 잎 안쪽에 아주아주 짧은 털을 숨겨 놓았어. 파리가 그 털 위에 앉으면. ,파리가 파리지옥의 짧은 털 위에 앉으면 어떻게 될까요?,잡아 먹힐 것 같아요.,PT03,21.0,4.333333333333333,6.0,73.0,2,2
2183,"으하하, 나는 한 번에 여러 마리도 먹을 수 있는 벌레잡이풀이다! 나의 무기는 물병처럼 생긴 주머니. 벌레가 꿀을 먹으러 왔다가 미끌미끌 미끄러져서 주머니 속에 쏙! 절대 빠져나오지 못할걸? ",벌레잡이풀의 무기는 무엇인가요?,물병처럼 생긴 주머니예요.,PT03,27.0,2.3333333333333335,4.0,107.0,2,2
2183,"으하하, 나는 한 번에 여러 마리도 먹을 수 있는 벌레잡이풀이다! 나의 무기는 물병처럼 생긴 주머니. 벌레가 꿀을 먹으러 왔다가 미끌미끌 미끄러져서 주머니 속에 쏙! 절대 빠져나오지 못할걸? ",벌레잡이풀은 벌레를 어떻게 잡나요?,벌레가 꿀을 먹으러 왔다가 미끄러져서 주머니 속에 쏙 들어가게 만들어요.,PT03,27.0,2.3333333333333335,4.0,107.0,2,2
2184,"내 주머니 입구에는 달콤한 꿀이 있고, 안에는 물이 고여 있어. 꿀을 찾아온 벌이 미끌미끌 풍덩! 벌은 절대 빠져나가지 못하니까, 슬슬 물에 녹여서 냠냠! ",주머니에 빠진 벌레를 어떻게 잡아먹나요?,슬슬 물에 녹여서 먹어요.,PT03,23.0,1.0,1.0,87.0,2,2
2184,"내 주머니 입구에는 달콤한 꿀이 있고, 안에는 물이 고여 있어. 꿀을 찾아온 벌이 미끌미끌 풍덩! 벌은 절대 빠져나가지 못하니까, 슬슬 물에 녹여서 냠냠! ",벌레들은 주머니에서 빠져 나가지 못할 때 무슨 생각을 할까요?,달콤함에 속았다고 생각할 것 같아요.,PT03,23.0,1.0,1.0,87.0,2,2
3879,“어! 빨간 열매가 뭉개졌어!” 브라키오가 싸움을 멈추고 외쳤어요. “우리가 싸우면서 열매를 밟았나 봐.” “싸우지 말 걸 그랬어.”,싸우면서 열매가 뭉개진 것을 본 공룡들은 어땠을까요?,싸우지 말 걸 하는 후회가 되었어요.,PT03,17.0,2.0,3.0,74.0,2,2
3879,“어! 빨간 열매가 뭉개졌어!” 브라키오가 싸움을 멈추고 외쳤어요. “우리가 싸우면서 열매를 밟았나 봐.” “싸우지 말 걸 그랬어.”,빨간 열매는 왜 뭉개졌나요?,공룡들이 싸우면서 열매를 밟아서요.,PT03,17.0,2.0,3.0,74.0,2,2
3887,"깜짝 놀란 선생님이 달려와요. “얘들아, 잠깐만!” 어머나! 심술 나무들이 점점 커져요. 심술 나뭇가지들이 친구들을 꽉 붙잡아요. “얘들아, 왜 심술이 났는지 선생님한테 이야기해 줄래?”",친구들이 선생님한테 뭐라고 말했을까요?,심술 나무가 커져서 싸우게 됐다고 말했을 거예요.,PT03,23.0,2.0,3.0,104.0,2,2
6867,마을 사람들은 허름한 차림의 낯선 두 나그네를 슬금슬금 피했어요. 하지만 두 나그네는 아무렇지도 않게 마을 빈터에 불을 피우고 솥을 걸었어요. 그리고 두 나그네는 큰 소리로 말했어요.,마을 사람들이 슬금슬금 피했을 때 두 나그네는 어떤 기분이었을까요?,아무렇지도 않았어요.,PT03,26.0,2.0,2.0,102.0,2,2
2186,크기는 작지만 엄청나게 많지. 주머니 덮개에 달린 털을 살짝만 건드려도 흡! 물과 함께 벌레까지 주머니 속으로 쏙 빨아들이지. 이렇게 잡아먹는 거야.,통발의 주머니는 어떻게 벌레를 잡아먹나요?,주머니 덮개에 달린 털을 살짝만 건드려도 물과 함께 벌레까지 주머니 속으로 빨아들여 잡아먹어요.,PT03,21.0,2.0,4.0,83.0,2,2
6870,"마을 사람들이 두 나그네 주위를 둘러쌌어요. 한 나그네가 큰 솥에 물을 붓자, 다른 나그네가 커다란 돌멩이 하나를 텀벙 집어넣었어요. “곧 맛있는 돌멩이 수프가 끓을 거예요.”",두 나그네는 큰 솥에 물을 붓고 커다란 돌멩이 하나를 집어넣어서 무엇을 만드나요?,맛있는 돌멩이 수프를 끓여요.,PT03,25.0,2.4285714285714284,4.0,98.0,2,2
6873,"“아! 감자와 양파를 넣으면 더 맛있을 텐데.” 한 젊은이가 집으로 달려가 감자와 양파를 가져왔어요. 나그네가 솥에 감자와 양파를 넣고 끓이자, 구수한 냄새가 온 마을에 퍼졌어요.",한 젊은이가 집으로 달려가 감자와 양파를 가져온 이유는 무엇인가요?,감자와 양파를 넣으면 더 맛있을 거라는 말을 들었기 때문이에요.,PT03,25.0,3.3333333333333335,4.0,100.0,2,2
6873,"“아! 감자와 양파를 넣으면 더 맛있을 텐데.” 한 젊은이가 집으로 달려가 감자와 양파를 가져왔어요. 나그네가 솥에 감자와 양파를 넣고 끓이자, 구수한 냄새가 온 마을에 퍼졌어요.",구수한 냄새가 온 마을에 퍼졌을 때 마을 사람들의 생각은 어떠했을까요?,돌멩이 수프가 정말 맛있을 거라고 생각했을 것 같아요.,PT03,25.0,3.3333333333333335,4.0,100.0,2,2
6869,"“정말 돌멩이로 수프를 끓인단 말이오?” “그럼요, 돌멩이 수프는 정말 맛있지요.” “우리가 끓인 돌멩이 수프 맛은 이웃 나라에서도 아주 유명해요.” 두 나그네는 큰 소리로 자랑했어요.",두 나그네의 말에 의하면 돌멩이 수프는 맛이 어떤가요?,정말 맛있어서 이웃 나라에서도 유명해요.,PT03,24.0,2.1666666666666665,5.0,103.0,2,2
6869,"“정말 돌멩이로 수프를 끓인단 말이오?” “그럼요, 돌멩이 수프는 정말 맛있지요.” “우리가 끓인 돌멩이 수프 맛은 이웃 나라에서도 아주 유명해요.” 두 나그네는 큰 소리로 자랑했어요.",돌멩이 수프 맛이 이웃 나라에서도 유명한 이유는 무엇일까요?,매우 맛있기 때문이에요.,PT03,24.0,2.1666666666666665,5.0,103.0,2,2
6875,"솥에서는 정말 맛있는 냄새가 났어요. “자, 이제 다 되었어요. 모두 그릇을 가지고 오세요.” 두 나그네는 수프를 떠서 사람들에게 나누어 주었어요. 물론 두 나그네도 아주 배부르게 먹었지요.",두 나그네는 수프를 어떻게 했나요?,사람들에게 나눠 주고 자신들도 배부르게 먹었어요.,PT03,26.0,2.5714285714285716,5.0,106.0,2,2
6868,"“자, 이제 시작해 볼까?” “그래, 돌멩이 수프를 끓이자고.” 마을 사람들은 두 나그네의 말을 듣고 깜짝 놀랐어요. “뭐? 돌멩이 수프?”",두 나그네는 무엇을 시작하자고 했나요?,돌멩이 수프를 끓이자고 했어요.,PT03,19.0,2.2,5.0,78.0,2,2
6868,"“자, 이제 시작해 볼까?” “그래, 돌멩이 수프를 끓이자고.” 마을 사람들은 두 나그네의 말을 듣고 깜짝 놀랐어요. “뭐? 돌멩이 수프?”",마을 사람들이 깜짝 놀란 이유는 무엇인가요?,두 나그네가 돌멩이 수프를 끓이자고 말하는 것을 들었기 때문이에요.,PT03,19.0,2.2,5.0,78.0,2,2
6872,“아! 고기와 옥수수가 조금 들어가면 더 맛있을 텐데.” 그러자 한 아저씨가 집으로 달려가 고기와 옥수수를 가지고 왔어요. 나그네는 얼른 솥에 고기와 옥수수를 넣었어요.,나그네는 고기와 옥수수를 어떻게 했나요?,솥에 넣었어요.,PT03,23.0,2.3333333333333335,4.0,94.0,2,2
6872,“아! 고기와 옥수수가 조금 들어가면 더 맛있을 텐데.” 그러자 한 아저씨가 집으로 달려가 고기와 옥수수를 가지고 왔어요. 나그네는 얼른 솥에 고기와 옥수수를 넣었어요.,한 아저씨가 고기와 옥수수를 가지고 온 이유는 무엇인가요?,고기와 옥수수가 조금 들어가면 더 맛있을 거라는 말을 들었기 때문이에요.,PT03,23.0,2.3333333333333335,4.0,94.0,2,2
3887,"깜짝 놀란 선생님이 달려와요. “얘들아, 잠깐만!” 어머나! 심술 나무들이 점점 커져요. 심술 나뭇가지들이 친구들을 꽉 붙잡아요. “얘들아, 왜 심술이 났는지 선생님한테 이야기해 줄래?”",심술이 난 친구들을 보고 선생님은 어떤 기분이였나요?,깜짝 놀랐어요.,PT03,23.0,2.0,3.0,104.0,2,2
3888,"다비는 부서진 과자와 사라진 크레파스 이야기를 해요. 친구들은 귀 기울여 이야기를 들어요. “아, 정말 화났겠다.” 그러자 심술 나무들이 점점 작아져요.",다비의 말에 귀기울여 들은 친구들은 어떤 생각을 했나요?,정말 화가 났겠다고 생각했어요.,PT03,20.0,1.75,3.0,85.0,2,2
6876,그 뒤로 이 마을은 돌멩이 수프로 유명해졌어요. 이웃 마을에서도 그 맛을 보러 찾아올 정도였지요. 그런데 두 나그네는 어디로 갔을까요?,이웃 마을에서 이 마을에 찾아오는 까닭은 무엇인가요?,돌멩이 수프의 맛을 보기 위해서에요.,PT03,19.0,1.5,2.0,75.0,2,2
2181,파리는 이제 꼼짝 못 해. 끈끈이 액이 나오는 샘털에 착 붙어 버렸거든. 파리의 온몸 을 샘털로 감쌌어. 이제 천천히 파리를 녹여 먹으면 돼. ,샘털에 붙은 파리는 어떻게 되나요?,끈끈이주걱이 녹여 먹어요.,PT03,23.0,3.5,5.0,80.0,2,2
2181,파리는 이제 꼼짝 못 해. 끈끈이 액이 나오는 샘털에 착 붙어 버렸거든. 파리의 온몸 을 샘털로 감쌌어. 이제 천천히 파리를 녹여 먹으면 돼. ,파리는 어디에 착 붙어서 꼼짝 못하게 되었나요?,끈끈이 액이 나오는 샘털에 착 붙어 버렸어요.,PT03,23.0,3.5,5.0,80.0,2,2
2175,우리에겐 쭈글쭈글 주름도 있어. 햇빛이 뜨겁게 내리쬐어도 주름 사이로 그늘이 지니까 몸이 덜 뜨거워져. 그래서 우리는 햇빛이 뜨거운 사막에서 견딜 수 있었지.,선인장에게 쭈글쭈글 주름이 없다면 어떻게 될까요?,몸이 뜨거워져 사막에서 견디기 힘들었을 거예요.,PT03,22.0,3.0,3.0,88.0,2,2
3755,“그러면 이 은이빨이 네 것이냐?” “네! 은이빨이 제 거예요!” 은토끼는 또박또박 대답했어요.,은토끼는 은이빨을 돌려 받았을까요?,"네, 돌려 받았을 것 같아요.",PT03,12.0,2.25,3.0,53.0,2,2
10383,"그럼 그냥 내버려 두면 되겠네. 아니야, 그러면 안 돼. 토마토를 토실토실하게 키우려면 일단 곁순부터 따 줘야 해.",토마토를 토실토실하게 키우기 위해 곁순을 따 줘야 하는 이유는 무엇일까요?,곁순이 토마토가 자라는 일을 방해하기 때문일 것 같아요.,PT03,17.0,2.0,2.0,64.0,2,2
8235,"따도 따도 계속 열리는 토마토! 먹으면 먹을수록 건강해지는 토마토! 익혀 먹으면 깜짝 놀랄 만큼 맛있는 토마토! 난 토마토가 제일 좋아. 나도, 나도! 오늘부터 나도 토마토가 제일 좋아! ",토마토는 어떻게 열리나요?,따도 따도 계속 열려요.,PT03,27.0,6.0,6.0,105.0,2,2
8235,"따도 따도 계속 열리는 토마토! 먹으면 먹을수록 건강해지는 토마토! 익혀 먹으면 깜짝 놀랄 만큼 맛있는 토마토! 난 토마토가 제일 좋아. 나도, 나도! 오늘부터 나도 토마토가 제일 좋아! ",토마토를 먹으면 먹을수록 건강해지는 이유는 무엇일까요?,건강에 좋은 영양분이 많이 들어있기 때문이에요.,PT03,27.0,6.0,6.0,105.0,2,2
3754,산신령을 찾아 헤매던 은토끼는 배가 고파서 사과를 아사삭 깨물었어요. 그때 은이빨이 쏙 빠져 버렸어요. 은토끼는 깜짝 놀라 큰 소리로 외쳤어요. “산신령님! 산신령님!” ,은이빨이 쏙 빠져 버려서 은토끼의 마음은 어떠하였나요?,깜짝 놀랐어요.,PT03,22.0,3.0,3.0,95.0,2,2
