textID,text,question,answer,questionType,word_count,word_avg,word_hard,length,Cluster,Difficulty_Level
33873,"고슴도치 라테는 땅바닥에 있는 무엇인가에 발이 걸려 감옥 안에서 넘어졌다. 머리 쪽에서 무슨 소리가 나는 것 같았다. 그 순간 라테는 딱딱한 것에 머리를 부딪쳤다. 그 뒤는 머리 속이 깜깜해지고 정신이 아득해져서 무슨 일이 일어났는지 기억할 수가 없었다. 얼마 뒤, 다시 정신이 들었을 때 고슴도치 라테는 자기가 지금 어디에 와 있는지 알 수가 없어서 주위를 둘러보았다.",다시 정신이 들었을 때 고슴도치 라테는 어떻게 하였나요?,자기가 지금 어디에 와 있는지 알 수가 없어서 주위를 둘러보았어요.,PT03,55.0,2.6363636363636362,6.0,207.0,2,6
33886,"""그래서 나는 펄쩍 뛸 듯이 기뻐하면서 생각했어. 이제야 구름이 오는구나. 그러나 그것은 구름이 아니라 커다란 매가 날고 있는 것이었지. 그리고 내가 미처 달아날 틈도 없이 그 매는 쏜살같이 내려와서는 내 엉덩이를 그 날카로운 발톱으로 잡고 하늘 높이 날아올라갔어. 나를 잡은 매는 멀리 북쪽으로 날기 시작했어.""",구름이 오는 줄 알았던 내 기분은 어땠나요?,너무 기뻤어요.,PT03,45.0,4.0,7.0,175.0,2,6
33892,"다람쥐 츄움은 이야기를 계속했다. ""그러자 매는 드디어 '이제 배가 고프구나.'하고 말했어. '자, 이제 곧 너를 먹어야겠다. 그러나 먹기 전에 우선 북쪽 숲과의 국경선으로 날아가서 오늘 밤을 지내기에 알맞은 장소부터 산 위에서 찾아보아야겠다.' 그래서 나는 대답해 주었지. '그래 찾아라, 누가 하지 말랬니?' 그러면서도 나는 마음 속으로는 딴 생각을 하고 있었지.""",마음속으로는 무슨 생각을 하고 있었을까요?,어떻게 도망갈 수 있을지 생각했을 것 같아요.,PT03,49.0,2.5714285714285716,5.0,206.0,2,6
33856,라테는 주위를 살펴본 다음 조심스럽게 다리에 한 발을 내디뎠다. 아무 일도 일어나지 않았다. 라테는 무사히 저쪽으로 건너갔다. 다 건너가서 라테는 살쾡이 나라를 뒤돌아보았다. 그러자 늑대 나라를 건너왔을 때와 똑같이 두 마리의 살쾡이 보초가 저쪽에서 라테를 바라보고 있었다.,무사히 저쪽으로 건너간 라테는 어떻게 하였나요?,건너간 후 라테는 살쾡이 나라를 뒤돌아보았어요.,PT03,37.0,2.0,4.0,153.0,2,6
33855,(여기서 떨어지는 것은 그다지 즐거운 일이 못 되겠다. 그런데 어떻게 여기를 건너간다지?) 그 때 라테는 골짜기의 제일 좁은 곳에 통나무로 만든 다리 하나가 놓여 있는 것을 보았다. 그 통나무는 어찌나 큰 것이었던지 말이나 마차도 건널 수 있을 것 같았고 양 옆에는 훌륭한 손잡이까지 있었다. 그러니까 조금 실수를 하더라도 다리에서 떨어질 염려는 없었다.,다리에서 떨어질 염려가 없다는 걸 확인한 라테의 기분은 어떨까요?,무사히 건널 수 있을 것 같아서 안심했을 것 같아요.,PT03,52.0,1.8333333333333333,3.0,198.0,2,6
33855,(여기서 떨어지는 것은 그다지 즐거운 일이 못 되겠다. 그런데 어떻게 여기를 건너간다지?) 그 때 라테는 골짜기의 제일 좁은 곳에 통나무로 만든 다리 하나가 놓여 있는 것을 보았다. 그 통나무는 어찌나 큰 것이었던지 말이나 마차도 건널 수 있을 것 같았고 양 옆에는 훌륭한 손잡이까지 있었다. 그러니까 조금 실수를 하더라도 다리에서 떨어질 염려는 없었다.,조금 실수하더라도 통나무 다리에서 떨어질 염려는 없는 이유는 무엇인가요?,통나무는 엄청 크고 양옆에는 훌륭한 손잡이까지 있었어요.,PT03,52.0,1.8333333333333333,3.0,198.0,2,6
33842,"살쾡이 나라와 늑대 나라의 국경은 급하게 흐르는 골짜기의 강이었다. 강은 양쪽에 높이 솟은 절벽 사이를 요란한 소리를 내면서 무척 빠르게 흐르고 있었다. 그 강에서 일어나는 물보라가 나뭇가지에 뿌려지고 거기에 햇빛이 비쳐서 아름다운 무지개가 되었다. (자, 이 강을 어떻게 건넌다지?) 고슴도치 라테는 목을 꼬면서 생각했다.",라테는 목을 꼬면서 무슨 생각을 했나요?,강을 어떻게 건널지 생각했어요.,PT03,44.0,2.5,5.0,181.0,2,6
33861,그러나 그 이상은 생각할 수가 없었다. 그것도 그럴 것이 곰들이 너무나 빨리 가기 때문에 고슴도치 라테는 질질 끌리면서 어디가 위쪽이고 어디가 아래쪽인지조차도 알 수 없게 되었기 때문이다. 나무들이 라테의 눈앞을 휙휙 지나갔다. 곰들은 조금도 쉬지 않고 그 부드러운 발로 나는듯이 걸어 고슴도치를 계속 앞으로 끌고 갔다. (이 곰들은 나를 어디로 끌고 가는 것일까.),곰들은 조금도 쉬지 않고 나는 듯이 걸어서 어떻게 하였나요?,고슴도치를 계속 앞으로 끌고 갔어요.,PT03,53.0,2.3333333333333335,5.0,205.0,2,6
33860,"""아하, 네가 고슴도치 라테로구나."" 세 마리 곰은 서로 얼굴을 마주 보면서 말했다. 그리고 갑자기 곰들은 달려들어 라테를 붙잡았다. 나무 사이로 마구 끌고 갔다. 끌려 가면서 라테는 생각했다. (이거 어떻게 된 거야? 어느 나라 말이나 다 하는 깃털이 고장이 났나? 곰의 말을 잘못한 것일까? 내가 무슨 실수를 했나?)",갑자기 달려들어 라테를 붙잡은 곰들은 어떻게 하였나요?,나무 사이로 마구 끌고 갔어요.,PT03,47.0,2.3,5.0,179.0,2,6
34034,"그러나 그래도 찾지 않을 수 없었다. 두 친구는 바람이 불어간 쪽으로 걷기 시작했다. 지독한 회오리바람은 지나간 모든 곳을 차마 볼 수 없을 만큼 처참하게 만들어 놓았다. 큰 나무는 쓰러지고, 바위는 산에서 굴러 떨어지고, 땅이 파이고. 모든 것이 엉망이 되어 있었다. 이런 형편 속에서 배낭을 찾아낸다는 것은 거의 있을 수 없는 일 같았다.",지독한 회오리바람이 지나간 곳은 어떻게 변했나요?,모든 것이 엉망이 되었어요.,PT03,52.0,3.0,6.0,191.0,2,6
34035,그러나 다람쥐 츄움은 어떻게 하든지 고슴도치를 도우려고 열심히 뛰었다. 츄움은 마치 아직도 회오리바람이 불고 있는 것처럼 빙빙 돌면서 여기저기를 마구 뛰어다녔다. 그리고 나뭇가지가 보이는 곳마다 혹시 거기에 배낭이 걸려 있지 않나 해서 가까이 가보곤 했다. 그러나 어느 곳에서도 츄움은 배낭을 찾지 못했고 실망만 했다. 고슴도치 라테도 열심히 찾았지만 늘 그랬던 것처럼 즐겁지가 않았다.,츄움은 베낭을 찾기 위해 어떻게 했나요?,회오리바람처럼 빙빙 돌면서 마구 뛰어 다녔어요.,PT03,53.0,2.6666666666666665,5.0,216.0,2,6
35645,또 어떤 아이들은 뱀이라는 뜻의 ‘아르가스’라고 부르며 놀리기도 하였습니다. 하지만 데모스테네스는 누가 뭐라고 놀리든 조금도 신경쓰지않고 자기 일에만 몰두하였습니다. 데모스테네스는 칼리스트라투스의 웅변을 듣고 난 뒤부터 오직 한 가지 생각에만 사로잡혀 있었습니다. ‘어떻게 해야 훌륭한 웅변가가 될 수 있을까?’ 고민하던 데모스테네스는 웅변을 배우기로 결심했습니다.,아이들의 놀림에 데모스테네스는 어떻게 행동했나요?,누가 뭐라고 놀리든 조금도 신경쓰지않고 자기 일에만 몰두했어요.,PT03,43.0,3.142857142857143,6.0,204.0,2,6
34035,그러나 다람쥐 츄움은 어떻게 하든지 고슴도치를 도우려고 열심히 뛰었다. 츄움은 마치 아직도 회오리바람이 불고 있는 것처럼 빙빙 돌면서 여기저기를 마구 뛰어다녔다. 그리고 나뭇가지가 보이는 곳마다 혹시 거기에 배낭이 걸려 있지 않나 해서 가까이 가보곤 했다. 그러나 어느 곳에서도 츄움은 배낭을 찾지 못했고 실망만 했다. 고슴도치 라테도 열심히 찾았지만 늘 그랬던 것처럼 즐겁지가 않았다.,"라테도 열심히 배낭을 찾았지만, 기분은 어땠나요?",즐겁지 않고 실망만 하고 있었어요.,PT03,53.0,2.6666666666666665,5.0,216.0,2,6
33874,"축축했고, 썩는 냄새가 코를 찔렀다. 숨도 제대로 쉴 수 없을 만큼 지독한 냄새였다. 그리고 너무나 추웠기 때문에 돌바닥에 누워 있던 라테는 몸을 덜덜 떨었다. 감옥 벽에서는 물방울이 뚝뚝 떨어졌다. 물은 벽의 바위가 갈라진 곳에서 흘러나와 마루위에 모였다가 다시 실 같은 작은 개울이 되어 어디론가 흘러갔다.",감옥 벽에서는 무엇이 뚝뚝 떨어지나요?,물방울이 떨어져요.,PT03,45.0,2.75,4.0,173.0,2,6
33895,"녀석은 '이 다람쥐는 우리 나라에 무엇인가를 훔치려고 온 것이 틀림없어.' 하더군. 그러면서 보초들은 감방 문을 쾅 닫아 걸었어. 그 뒤 열흘 동안이나 나는 먹을 것도 없이 여기에 갇혀 있었어. 고슴도치야, 이거 정말 재미없는 일이야. 이렇게 배가 고프기는 난생 처음이라니까.""",보초들이 감방 문을 닫고 나서 어떻게 되었나요?,열흘 동안이나 먹을 것도 없이 갇혀 있었어요.,PT03,39.0,3.6,7.0,155.0,2,6
33940,"큰 곰, 작은 곰, 뚱뚱보, 빼빼, 늙은 곰, 젊은 곰, 흰곰, 검은 곰, 온갖 곰이 다 모였다. 광장은 금세 꽉 찼다. 그리고 조금 뒤에 곰임금 반두르가 힘찬 걸음으로 나타났다. 곰임금은 늙은 곰이 아까 가져다 놓은 의자에 올라가 버티고 앉았다. ""저것 봐. 임금의 자리라고 내가 그랬지."" 츄움은 자기의 말이 맞았다고 뽐냈다.",힘찬 걸음으로 나타난 곰 임금 반두르는 어떻게 했나요?,늙은 곰이 아까 가져다 놓은 의자에 올라가 앉았어요.,PT03,50.0,2.0,4.0,184.0,2,6
33939,"곰임금 반두르는 이를 드러내고 연설을 시작했다. ""북쪽 숲의 곰 시민들아! 오늘은 도저히 믿을 수 없는 일이 일어났다. 알겠느냐! 우리는 속임수에 빠진 것이다!"" 광장에 모인 곰들이 으르렁거렸다. ""더욱이 우리를 속인 것은, 콩알만한 작은 고슴도치 한 마리란 말이다!"" 반두르 임금은 한층 소리 높여 외쳤다.",속임수에 빠졌다는 임금 반두르의 말에 곰들은 어떻게 반응했나요?,광장에 모인 곰들이 으르렁거렸어요.,PT03,42.0,2.75,5.0,172.0,2,6
33938,"""저쪽 바위벽에 검은 구멍이 하나 있다. 저기 숨자."" 둘이 그 곳으로 달려갔다. 그 구멍은 마침 둘이 숨기에 꼭 알맞은 크기였다. 둘은 아슬아슬하게 그 구멍에 숨었다. 막 숨자마자 광장의 사방에 나 있는 길에서 많은 곰들이 모이기 시작했다. 곰들은 광장에 둥근 원을 그리며 섰다.",둘이 숨자마자 어떤 일이 벌어졌나요?,광장의 사방에 나 있는 길에서 곰들이 모이기 시작했어요.,PT03,42.0,3.0,7.0,157.0,2,6
33865,"그러나 그 밖의 다른 곰들은 별로 할 일이 없는지 그냥 빈둥거리고 있을 뿐이었다. 할 일이 없는 곰들은 끌려온 포로의 신세가 된 고슴도치 라테를 재미있는 듯이 구경했다. 그 중의 한 마리가 물었다. ""무엇하는 녀석이냐?"" ""이 녀석은 고슴도치 라테라고 하는 녀석인데 '물이 솟는 돌'을 훔치려고 왔어."" 라테를 끌고온 곰들이 대답했다.",별로 할 일이 없는지 그냥 빈둥거리고 있는 곰들은 무얼 하고 있나요?,끌려온 포로의 신세가 된 고슴도치 라테를 재미있는 듯이 구경했어요.,PT03,48.0,4.333333333333333,7.0,187.0,2,6
33864,고슴도치의 가벼운 발이 아무리 밟아도 바닥에는 아무 자국도 남지 않았다. 이 광장에는 바위산 안의 여러 곳으로 통하는 여러 갈래의 길이 사방으로 뻗어 있었다. 라테는 많은 곰들이 저마다 다른 방향으로 왔다갔다 하는 모습을 보았다. 그 중의 몇 마리는 무슨 바쁜 일이라도 있는지 부지런히 왔다갔다 하고 있었다. (저 곰들은 아마 자기의 왕의 명령으로 바쁘게 돌아다니고 있나 보다.) 라테는 속으로 생각했다.,바쁜 일이라도 있는지 부지런히 왔다 갔다 하고 있는 건 왜 그럴까요?,아마 자기의 왕의 명령으로 바쁘게 돌아다니고 있다는 생각이 들어요.,PT03,58.0,2.0,3.0,226.0,2,6
33829,흔히 요즘은 마녀가 거의 없어졌다고 생각하지만 숲 속 깊숙이 들어가면 지금도 마녀가 살고 있다. 쓰러진 소나무 가지라든가 어두운 바위 속에 마녀의 집이 있다. 밤이 되면 마녀들은 마녀의 차를 끓인다. 그러면 부연 연기가 마녀의 꿀뚝에서 피어오른다. 그러나 라테는 이제까지 한 번도 마녀를 본 일이 없었다.,밤이 되면 마녀들은 무엇을 하나요?,마녀의 차를 끓여요.,PT03,44.0,3.6,6.0,170.0,2,6
33828,길을 떠난 라테는 북으로 북으로 걸었다. 얼마 동안은 익숙한 길이었지만 북으로 감에 따라서 낮선 길이 되었다. 저녁이 되어 사방이 어두워졌을 때 라테는 난생 처음 보는 낯선 길을 걷고 있었다. 그 때 고슴도치 라테는 허리가 구부러진 자그만 마녀를 보았다. 그 마녀는 커다란 보퉁이를 지고 라테 앞에서 걸어가고 있었다.,난생처음 보는 낯선 길을 걷고 있을 때 라테가 본 건 무엇인가요?,자그만 마녀를 보았어요.,PT03,47.0,3.2,5.0,177.0,2,6
33827,그래서 마녀가 앞에서 가고 있는 것을 보자 라테는 감짝 놀랐다. 마녀 할머니는 커다란 봇짐을 지고 지친 듯이 다리를 끌면서 가고 있었다. 길고 끝이 뾰족한 마녀의 코에는 땀 한 방울이 맺혀 있었다. 귀에는 금귀고리가 빛나고 머리에는 커다란 모자를 썼는데 모자 깃에는 까마귀 깃털 한 개가 꽂혀 있었다. 그 마녀는 숨을 헉헉거기면서 계속해 걸어가고 있었다.,숨을 헉헉거리며 걸어가는 마녀를 보고 라테는 어떻게 했을까요?,마녀가 너무 힘들어 보여서 짐을 들어서 도와주려고 할 것 같아요.,PT03,53.0,3.8,7.0,198.0,2,6
33827,그래서 마녀가 앞에서 가고 있는 것을 보자 라테는 감짝 놀랐다. 마녀 할머니는 커다란 봇짐을 지고 지친 듯이 다리를 끌면서 가고 있었다. 길고 끝이 뾰족한 마녀의 코에는 땀 한 방울이 맺혀 있었다. 귀에는 금귀고리가 빛나고 머리에는 커다란 모자를 썼는데 모자 깃에는 까마귀 깃털 한 개가 꽂혀 있었다. 그 마녀는 숨을 헉헉거기면서 계속해 걸어가고 있었다.,마녀 할머니는 어떻게 걸어가고 있나요?,커다란 봇짐을 지고 지친 듯이 다리를 끌면서 가고 있었어요.,PT03,53.0,3.8,7.0,198.0,2,6
33894,"그 바위는 매란 녀석의 식탁으로는 아주 안성맞춤으로 보였어. 그런데 매가 막 그 바위에 내리자마자 바위 그늘에서 무서운 울부짖음이 들리더니, 화가 머리끝까지 난 곰 한 마리가 머리를 내밀었지 뭐야. 매는 깜짝 놀라서 나를 내동댕이치고는 날개야 날 살려라 하며 하늘로 다시 날아올라갔지. ",깜짝 놀란 매는 어떻게 하였나요?,나를 내동댕이치고 하늘로 다시 날아올랐어요.,PT03,40.0,3.375,6.0,160.0,2,6
33899,"땅 속의 굴. 다람쥐 츄움이 배불리 먹고 난 다음에 고슴도치 라테는 말했다. ""우리는 이 동굴 안을 샅샅이 살펴보아야 해. 여기서 빠져나갈 수 있을지 없을지 알아보아야 한단 말이야."" ""그것은 아마 쓸데없는 노력일걸. 나는 벌써 이 감옥 안을 죄다 살펴보았단 말이야. 그러나 여기에는 도망할 만한 창문도 없고 비밀의 문 같은 것은 더더구나 없어.""",도망갈 만한 창문도 없고 비밀의 문 같은 것도 없는 곳에서 어떻게 해야 할까요?,다시 한번 더 감옥 안을 꼼꼼히 살펴서 도망갈 만한 곳을 찾아봐야 해요.,PT03,51.0,2.4,6.0,194.0,2,6
33996,"그러나 라테는 겉으로는 아무렇지도 않은 체하고 대답했다. ""고맙습니다. 이렇게 크게 환영해 주시니 참으로 고맙습니다."" ""우리 숲에 당신 같은 손님이 오기는 처음이니까요. 고슴도치 라테 님, 그리고 다람쥐 츄움 씨, 우리의 위대한 지배자이며 피에 굶주린 글프스 임금님은 오늘 저녁 두 분을 위해서 큰 잔치를 베풀 것입니다."" ""그것 참 고마운 일이군요. 그런데 글프스 임금님의 궁전은 여기서 멉니까?""",글프스 임금님이 오늘 저녁 둘을 위해 하려는 건 무엇인가요?,큰 잔치를 베풀려고 해요.,PT03,54.0,3.111111111111111,5.0,224.0,2,6
33834,"안으로 들어간 라테는 숨이 턱에 닿아 헉헉거리며 마녀의 봇짐을 땅바닥에 내려놓았다. 그 때야 마녀는 입을 열었다. 마녀는 차를 끓이면서 새된 목소리로 말했다. ""너는 남을 돕기를 좋아하는 것 같구나. 너 같은 꼬마는 요즘 흔하지 않지. 그런데 어디까지 가는 길이지?""",안으로 들어간 라테는 어떻게 했나요?,헉헉거리며 마녀의 봇짐을 땅바닥에 내려놓았어요.,PT03,38.0,2.0,3.0,149.0,2,6
33833,"다음 날 아침, 고슴도치 라테가 길을 떠나려고 할 때였다. 마녀가 자기 모자를 가지고 와서 그 모자에 꽂힌 까마귀 깃털을 뽑아 주면서 말했다. ""이 깃털을  가지고 가거라. 이 깃털만 가지면 어떤 숲의 말이라도 다 할 수 있게 된단다. 어느 나라 말이나 다 할 수 있는 거야. 아마 곰나라의 무서운 보초들과 만났을 때 이것도 도움이 될 것이다.""",고슴도치 라테가 길을 떠나려고 할 때 마녀는 무엇을 주었나요?,자기 모자에 꽂힌 까마귀 깃털을 뽑아 주었어요.,PT03,55.0,2.5,7.0,193.0,2,6
33832,"그러면서 마녀는 처음으로 라테를 똑바로 보았는데 그 눈이 어찌나 날카로운지 라테는 깜짝 놀랐다. ""북쪽 숲의 곰나라로 가는 길입니다."" 라테는 대답했다. ""아, 그럼 네가 '물이 솟는 돌'을 가지러 가는 고슴도치로구나. 오늘 아침 숲에서 짐승들이 얘기 하는 것을 들었다."" 그 뒤부터 마녀는 친절해졌다. 오늘 밤은 자기 집에서 자고 가라는 말까지 했다.",마녀는 라테가 물이 솟는 돌을 가지러 간다는 것을 어떻게 알았을까요?,오늘 아침 숲에서 짐승들이 얘기하는 것을 들어서요.,PT03,49.0,1.25,2.0,197.0,2,6
33832,"그러면서 마녀는 처음으로 라테를 똑바로 보았는데 그 눈이 어찌나 날카로운지 라테는 깜짝 놀랐다. ""북쪽 숲의 곰나라로 가는 길입니다."" 라테는 대답했다. ""아, 그럼 네가 '물이 솟는 돌'을 가지러 가는 고슴도치로구나. 오늘 아침 숲에서 짐승들이 얘기 하는 것을 들었다."" 그 뒤부터 마녀는 친절해졌다. 오늘 밤은 자기 집에서 자고 가라는 말까지 했다.",마녀가 친절해진 이유는 무엇일까요?,라테가 물이 솟는 돌을 가지러 가는 것을 알았기 때문이에요.,PT03,49.0,1.25,2.0,197.0,2,6
33958,"그러나 그 때, 라테가 츄움의 발을 꼭 잡았다. ""저것 봐!"" 나무 사이로 네 마리의 보초곰이 서 있는 것이 보였다. 가까이 가 보니, 그 곰들은 고슴도치가 처음 여기를 건너 올 때 잡아갔던 그 보초들이었다. 그 때, 숲 안쪽에서 요란한 소리가 들렸다. 그 소리는 땅이 막 울릴 만큼 요란한 것이었다.",고슴도치가 처음 여기를 건너 올 때 어떤 일이 있었나요?,네 마리의 보초곰이 잡아갔어요.,PT03,48.0,2.6666666666666665,7.0,168.0,2,6
34027,오래 기다리지 않아서 회오리바람이 닥쳐왔다. 소나무의 큰 가지와 작은 뿌리가 움직이기 시작했다. 그러더니 바람은 끝내 나무를 통째로 뽑았다. 뽑힌 나무는 빙빙 돌면서 하늘로 말려올라갔다. 라테와 츄움은 겁에 질려서 쓰러진 큰 전나무를 꼭 잡고 있었다. 그 나무도 흔들리고 땅이 온통 떨리는 것 같았다.,쓰러진 큰 전나무를 꼭 잡고 있는 라테와 츄움의 마음은 어떨까요?,너무 무서워서 잔뜩 겁에 질려 있을 것 같아요.,PT03,42.0,4.5,7.0,168.0,2,6
33924,곰임금 반두르. 그러나 그 검은 곰은 고슴도치와 다람쥐를 발견하지는 못한 모양이었다. 다만 냄새가 의심스럽다는 듯이 주의를 살필 뿐이었다. (저 곰은 어떻게 여기 들어왔을까?) 라테는 이상하다고 생각했다. 그러나 그 때 개울 저쪽에 큰 동굴 구멍이 하나 있는 것이 보였다.,개울 저쪽에 큰 동굴 구멍이 하나 있는 것을 본 라테는 어떤 생각이 들었을까요?,미처 확인하지 못한 동굴 구멍이 있다는 걸 깨달았을 것 같아요.,PT03,38.0,2.0,3.0,152.0,2,6
33964,가까이 가서 보니 큰 소나무로 올라가는 계단이 있었다. 나뭇가지를 엮어서 짠 계단이었다. 그 계단은 높은 곳까지 계속되어 있었다. 살쾡이 보초들은 포로를 계단 위로 끌고 올라갔다. 나무 속으로 들어왔는지 갑자기 어두워졌다. 이제 두 포로는 어디로 가는지 짐작조차 할 수 없게 되었다.,어디로 가는지 짐작조차 할 수 없게 된 이유는 무엇인가요?,나무 속으로 들어왔는지 갑자기 어두워졌기 때문이에요.,PT03,40.0,2.5,5.0,158.0,2,6
33899,"땅 속의 굴. 다람쥐 츄움이 배불리 먹고 난 다음에 고슴도치 라테는 말했다. ""우리는 이 동굴 안을 샅샅이 살펴보아야 해. 여기서 빠져나갈 수 있을지 없을지 알아보아야 한단 말이야."" ""그것은 아마 쓸데없는 노력일걸. 나는 벌써 이 감옥 안을 죄다 살펴보았단 말이야. 그러나 여기에는 도망할 만한 창문도 없고 비밀의 문 같은 것은 더더구나 없어.""",다람쥐 츄움이 배불리 먹고 난 다음 라테가 하자고 한 것은 무엇인가요?,동굴 안을 샅샅이 살펴보아야 한다고 했어요.,PT03,51.0,2.4,6.0,194.0,2,6
33809,그러나 숲 속 어디를 찾아보아도 물이라고는 보이지 않았다. 곳곳에 흐르던 개울은 바싹 말라 밑바닥이 갈라졌다. 하늘에는 구름 한 점 보이지 않았다. 개울에서는 음악 소리 같은 물 흐르는 소리가 들렸는데 지금은 그런 소리를 들을 수가 없었다. 작은 늪과 웅덩이 들도 바싹 말라 버렸다. 전에는 고슴도치의 친구들이 거기서 물장구를 치면서 멱도 감았는데 지금은 그럴 수가 없었다.,작은 늪과 웅덩이들도 바싹 말라 버린 이유는 무엇일까요?,비가 안와서요.,PT03,54.0,2.0,4.0,209.0,2,6
33914,"이윽고 둘은 굴의 끝에 이르렀다. 거기서 발길을 멈춘 둘은 너무나도 놀라운 광경에 그만 입을 딱 벌리고 말았다. 둘의 앞에는 크고 맑은 호수가 펼쳐져 있었다. 그 호수는 너무나 넓어서 저쪽 끝이 보이지 않았지만, 그러나 호수는 틀림없이 이 산 안에 있는 것이었다. 그 곳은 산 밑이었다. 둘은 먼저보다 더 넓은 산 속의 광장에 나온 셈이었다.",굴의 끝에서 발길을 멈춘 둘은 어땠나요?,너무나도 놀라운 광경에 그만 입을 딱 벌리고 말았어요.,PT03,53.0,1.1666666666666667,2.0,191.0,2,6
33912,"그러자 물 흐르는 소리 같은 것이 아련하게 들리고 바람이 조금 지나간 것 같았다. 그러고 보니 공기도 꽤 맑아진 것 같았다. ""가자! 이제 곧 무엇이 나타날 것 같다!"" 라테가 말했다. 정말 그랬다. 둘이 걸어나감에 따라 조금씩 빛이 들어오면서 차츰차츰 밝아졌다. 물 흐르는 소리는 아까보다 훨씬 똑똑히 들렸다.","물 흐르는 소리가 아까보다 훨씬 똑똑히 들리자, 둘의 기분은 어땠을까요?",나갈 수 있다는 기대감에 기분이 들떴을 것 같아요.,PT03,46.0,2.0,5.0,174.0,2,6
33981,티브르의 궁전 앞까지 왔을 때 라테는 조심스럽게 주위를 둘러보았다. 아무도 없었다. 고슴도치 라테는 궁전에 살짝 들어가 넓은 방 하나하나를 살피면서 돌아다녔다. 그러나 얼마 동안은 신기한 돌을 찾아내지 못했다. 그런데 어느 한 방에 들어갔을 때의 일이다. 스무 마리쯤의 살쾡이들이 있었는데 모두가 잠에 곪아떨어져 있었다.,스무 마리쯤의 살쾡이들이 모두가 잠에 골아 떨어져 있는 것을 본 라테는 어떻게 했을까요?,살쾡이들을 깨우지 않기 위해 더욱 조용히 조심해서 다녔을 것 같아요.,PT03,43.0,3.0,5.0,179.0,2,6
33980,잠자는 그 살쾡이들은 다 임금의 호위병들이었다. (이 근처에 돌이 있을 것 같다.) 이렇게 생각하면서 라테는 그 옆의 넓은 방으로 들어갔다. 그 방 안 쪽에 작은 방이 하나 있었다. 그 작은 방에는 온갖 잡동사니가 있었다. 뼈다귀니 두개골이니 금덩어리 같은 것도 있었다.,온갖 잡동사니가 있는 작은 방을 보고 무슨 생각을 했을까요?,돌이 이 방에 있을지도 모른다고 생각했을 것 같아요.,PT03,40.0,1.8,4.0,151.0,2,6
