textID,text,question,answer,questionType,word_count,word_avg,word_hard,length,Cluster,Difficulty_Level
44521,그때 박사님이 산더미 같은 잡동사니 틈으로 고개를 쑥 내밀고 말했어요. “이제 좀 눈치 챘니? 기대하시라! 이 박사님이 손으로 직접 만든 수제 미니 워터파크!” 박사님이 땀을 줄줄 흘리며 만들고 있는 건 다름 아닌 삼총사를 위한 물놀이 기구들이었어요! 삼총사는 환호성을 지르며 한목소리로 외쳤어요. “우와! 박사님 최고예요!” 박사님이 껄껄껄 웃으며 말했어요. “이제 이것들을 마저 다 고친 후에 연구소 옆 공터로 옮겨서 미니 워터파크를 세울 거야.” 삼총사는 기뻐서 펄쩍펄쩍 뛰었어요. “박사님! 저희도 도울게요!” “저희랑 같이 만들어요!”,워터파크를 만들고 있다는 소리에 삼총사는 어땠나요?,환호성을 지르며 박사님 최고라고 했어요.,PT03,72.0,1.8571428571428572,3.0,304.0,1,4
44521,그때 박사님이 산더미 같은 잡동사니 틈으로 고개를 쑥 내밀고 말했어요. “이제 좀 눈치 챘니? 기대하시라! 이 박사님이 손으로 직접 만든 수제 미니 워터파크!” 박사님이 땀을 줄줄 흘리며 만들고 있는 건 다름 아닌 삼총사를 위한 물놀이 기구들이었어요! 삼총사는 환호성을 지르며 한목소리로 외쳤어요. “우와! 박사님 최고예요!” 박사님이 껄껄껄 웃으며 말했어요. “이제 이것들을 마저 다 고친 후에 연구소 옆 공터로 옮겨서 미니 워터파크를 세울 거야.” 삼총사는 기뻐서 펄쩍펄쩍 뛰었어요. “박사님! 저희도 도울게요!” “저희랑 같이 만들어요!”,삼총사는 펄쩍펄쩍 뛰며 기분이 어떨까요?,너무 기뻐요.,PT03,72.0,1.8571428571428572,3.0,304.0,1,4
44527,"마리가 그 모습을 보고 깔깔 웃으며 말했어요. “하여간 못 말려! 바짝 마른 미끄럼틀을 그냥 타고 내려오면 어떡해! 당연히 마찰력 때문에 엉덩이가 뜨겁지!” “아야야! 워터파크 슬라이드에서는 괜찮았는데!” “거긴 물이 흘러나와서 미끄럽잖아. 여긴 아직 박사님이 물을 뿌리지 않은 거고!” 박사님은 수영장에 물을 다 채우고 미끄럼틀 위쪽에 호스를 연결해 물이 흘러내리게 했어요. 그러자 유비와 마리가 느긋하게 미끄럼틀을 타고 내려왔어요. “물 때문에 마찰력이 줄어서 쓩 내려간다!” 투덜이는 입을 삐죽 내밀었어요. “쳇, 그런 비밀이 숨어 있는지 내가 어떻게 아냐! 하마터면 내 엉덩이에 불나서 119 출동할 뻔했다!” 투덜이는 농담을 하더니 유비에게 마구 물을 튕겼어요. 그와 동시에 삼총사의 즐거운 물싸움이 시작되었어요.",바짝 마른 미끄럼틀을 타고 내려오면 어떻게 되나요?,마찰력 때문에 엉덩이가 뜨거워요.,PT03,94.0,1.8,3.0,404.0,1,4
44524,"유비가 뭔가 더 설명하며 아는 체를 하려는데 투덜이는 들은 척도 하지 않고 손수레를 끌고 쌩하니 가 버렸어요. 손수레는 제법 컸지만 바퀴 덕분에 가볍게 굴러갔어요. “너 투덜이한테 잘난 체 하려다 망했구나.” 마리가 고소하다는 듯 킥킥 웃더니 다른 손수레를 끌고 곧장 박사님에게 달려갔어요. 혼자 남은 유비는 머쓱해져서 괜히 흠흠 헛기침을 하고는 남은 손수레를 끌고 뒤따라갔어요. “박사님, 저희 준비 다 됐어요!” 박사님은 어느새 미니 풀장과 튜브, 파라솔 등 온갖 물놀이 기구들을 마치 새 것처럼 수리해 놓았어요. 삼총사는 그것들을 차례로 손수레에 실었어요. “이제 내가 일러주지 않아도 척척 하는구나!”",박사님은 삼총사가 물놀이 기구들을 차례로 손수레에 싣는 것을 보고 어떻게 말했나요?,내가 일러주지 않아도 척척 한다고 말했어요.,PT03,84.0,1.7142857142857142,3.0,340.0,1,4
44523,유비는 분수 옆에 있는 작은 음수대를 발견했어요. 먹는 물이 나오는 음수대에는 이런 글이 붙어 있었어요. ‘최신 발명품-깨끗한 생수로 만든 얼음사탕!’ 유비가 버튼을 누르자 시원한 얼음사탕이 한 컵 가득 쏟아져 나왔어요! 유비와 투덜이가 시원하고 달콤한 얼음사탕을 우적우적 씹느라 정신이 없을 때 마리가 공터 한쪽을 가리켰어요. “몽몽이가 말한 게 바로 저건가 봐!” 마리가 가리킨 곳에는 손수레가 여러 대 서 있었어요. “바퀴가 달린 수레를 이용하면 무거운 것들도 쉽게 옮길 수 있어!” 마리의 말에 유비도 잘난 체를 하며 말했어요. “나도 알아! 무거운 걸 옮기려면 마찰력을 줄여야 해!”,유비가 최신 발명품 버튼을 누르자 어떻게 되었나요? ,얼음 사탕이 나왔어요.,PT03,83.0,3.142857142857143,5.0,331.0,1,4
44755,"박사님이 의기양양한 표정으로 말했어요. “내가 주문을 외면 바닷물이 쩍 갈라지면서 길이 생길 거야. 마치 성경에 나오는 모세의 기적처럼!” 삼총사는 박사님의 말을 믿지 않았어요. “에이, 거짓말이죠?” “박사님은 마술사가 아니라 과학자잖아요!” “바닷물이 안 갈라지면 어떡하실 건데요?” 그러자 박사님이 빙그레 웃으며 말했어요. “만약 내 말대로 바다가 안 갈라지면 너희들한테 놀이공원 자유 이용권과 맛있는 간식을 사 줄게.” “우와! 진짜요?” 삼총사가 펄펄 뛰며 좋아하자 박사님이 다시 말했어요. “그 대신 내 말대로 바다가 갈라지면 이번 주말에 너희가 연구소 대청소를 하는 거야. 오케이?” 삼총사는 잠깐 망설이다 이내 고개를 끄덕였어요. “좋아요. 어쨌든 지면 약속 꼭 지키셔야 해요!”",박사님이 자유 이용권과 간식을 사준다고 약속하자 삼총사는 어떤 반응을 보였나요?,펄펄 뛰며 좋아했어요.,PT03,89.0,2.4285714285714284,7.0,388.0,1,4
44525,삼총사는 박사님과 함께 손수레를 이용해 모든 물놀이 도구들을 공터로 금세 옮길 수 있었어요. 그리고 박사님이 미리 만들어 놓은 지레와 다양한 도구들을 사용하여 미끄럼틀을 뚝딱 세웠어요. 그 옆에 누워서 쉴 수 있는 의자들을 여러 개 배치하고 빨간색 파라솔도 한쪽에 예쁘게 놓아두었어요. “점점 그럴듯해 진다!” 바람 빠진 미니 풀장에 바람을 빵빵하게 불어넣자 작지만 튼튼한 수영장도 만들어졌어요. “우와! 진짜 워터파크에 온 것 같아요!” 박사님이 미끄럼틀 아래에 연결해 놓은 수영장에 물을 채우기 시작하자 삼총사는 신이 나서 팔짝팔짝 뛰었어요. “뭐 하냐옹? 얼른 수영복 갈아입으라옹.” 어느새 의자 위에 올라가 자리를 잡은 몽몽이가 공터 옆쪽을 가리켰어요.,몽몽이는 어디에 자리를 잡고 삼총사에게 수영복을 갈아입으라며 공터 옆쪽을 가리켰나요?,의자 위에 올라가 자리를 잡고 말했어요.,PT03,89.0,1.9090909090909092,4.0,369.0,1,4
44710,"롤러코스터는 점점 더 속력을 올렸어요. 빠르게 달리던 롤러코스터가 높은 곳에서 낮은 곳으로 순식간에 떨어지자 삼총사는 물론 함께 탄 사람들도 ‘꺄악!’비명을 질렀어요. 유비와 투덜이는 마치 경쟁을 하듯 엄청 시끄러운 소리로 쉴 새 없이 비명을 질러댔어요. 잠시 후, 긴 코스를 한 바퀴 돈 롤러코스터가 속도를 줄이며 출발 지점으로 돌아왔어요. 마리는 몹시 아쉬워하며 말했어요. “너무 금방 끝났다. 그렇지, 얘들아?” 그런데 유비는 입을 벌린 채 넋이 나가 있었고, 투덜이는 눈물을 줄줄 흘리며 ‘으앙, 엄마!’하고 계속 소리를 지르고 있었어요. “아이고, 이 겁쟁이들! 정신 차려! 일본까지 와서 이게 웬 망신이람! 창피해 죽겠네!” 마리는 고개를 절레절레 흔들며 두 친구를 쏘아보았어요.",몹시 아쉬워하며 말하는 마리를 보고 알 수 있는 것은 무엇일까요?,마리는 롤러코스터를 좋아해서 다시 또 타고 싶어 하는 것 같아요.,PT03,93.0,2.6363636363636362,7.0,386.0,1,4
44710,"롤러코스터는 점점 더 속력을 올렸어요. 빠르게 달리던 롤러코스터가 높은 곳에서 낮은 곳으로 순식간에 떨어지자 삼총사는 물론 함께 탄 사람들도 ‘꺄악!’비명을 질렀어요. 유비와 투덜이는 마치 경쟁을 하듯 엄청 시끄러운 소리로 쉴 새 없이 비명을 질러댔어요. 잠시 후, 긴 코스를 한 바퀴 돈 롤러코스터가 속도를 줄이며 출발 지점으로 돌아왔어요. 마리는 몹시 아쉬워하며 말했어요. “너무 금방 끝났다. 그렇지, 얘들아?” 그런데 유비는 입을 벌린 채 넋이 나가 있었고, 투덜이는 눈물을 줄줄 흘리며 ‘으앙, 엄마!’하고 계속 소리를 지르고 있었어요. “아이고, 이 겁쟁이들! 정신 차려! 일본까지 와서 이게 웬 망신이람! 창피해 죽겠네!” 마리는 고개를 절레절레 흔들며 두 친구를 쏘아보았어요.",롤러코스터를 타고 난 뒤 투덜이는 어땠나요?,눈물을 흘리며 엄마하고 계속 소리를 질렀어요.,PT03,93.0,2.6363636363636362,7.0,386.0,1,4
44527,"마리가 그 모습을 보고 깔깔 웃으며 말했어요. “하여간 못 말려! 바짝 마른 미끄럼틀을 그냥 타고 내려오면 어떡해! 당연히 마찰력 때문에 엉덩이가 뜨겁지!” “아야야! 워터파크 슬라이드에서는 괜찮았는데!” “거긴 물이 흘러나와서 미끄럽잖아. 여긴 아직 박사님이 물을 뿌리지 않은 거고!” 박사님은 수영장에 물을 다 채우고 미끄럼틀 위쪽에 호스를 연결해 물이 흘러내리게 했어요. 그러자 유비와 마리가 느긋하게 미끄럼틀을 타고 내려왔어요. “물 때문에 마찰력이 줄어서 쓩 내려간다!” 투덜이는 입을 삐죽 내밀었어요. “쳇, 그런 비밀이 숨어 있는지 내가 어떻게 아냐! 하마터면 내 엉덩이에 불나서 119 출동할 뻔했다!” 투덜이는 농담을 하더니 유비에게 마구 물을 튕겼어요. 그와 동시에 삼총사의 즐거운 물싸움이 시작되었어요.",투덜이가 유비에게 물을 튕기자 삼총사는 무엇을 하였나요?,즐거운 물싸움을 시작했어요.,PT03,94.0,1.8,3.0,404.0,1,4
44708,"마리가 유비를 보며 이어서 말했어요. “게다가 안전띠와 안전장치가 있으니까 너 혼자 떨어질 일은 없을 거야. 이제 겁 안 나지?” “그, 그래! 원운동과 구심력! 그런 거지! 나도 원래 알고 있었는데 잠깐 까먹었어.” 유비는 어색하게 ‘하하!’하고 웃었어요. 마리가 다시 물었어요. “이제 원리를 알고 나니까 하나도 겁 안 나지?” “야! 원래 겁난 거 아니라니까! 사실은 너희가 원심력과 구심력에 대해 알고 있나 보려고 그랬지. 하하하!” 그러자 마리가 킥킥 웃었어요. “그럼 다행이네. 이제 우리가 탈 차례니까!” 어느덧 줄은 쑥쑥 줄어들어 삼총사의 차례가 왔어요.",마침내 삼총사는 롤러코스터를 잘 탔을까요?,마리와 투덜이는 유비를 데리고 롤러코스터를 잘 탔을 것 같아요.,PT03,78.0,2.8181818181818183,5.0,318.0,1,4
44699,"총사는 황박사님 연구소에 모여 멍하니 앉아 있었어요. 박사님은 며칠 전 일본의 수도 도쿄로 출장을 가셨어요. 전 세계 과학자들이 모이는 세미나에 참석하신 거예요. 유비가 하품을 하며 말했어요. “박사님이 안 계시니 정말 심심하다.” “맞아. 박사님한테 엉뚱한 발명품에 대한 이야기를 들으면 시간 가는 줄 몰랐는데.” 투덜이가 유비의 말에 맞장구를 쳤어요. 그때 마리가 휴대폰을 들여다보며 말했어요. “참, 박사님이 우리한테 무슨 선물을 보냈다고 하던데?” “무슨 선물?” 유비와 투덜이의 눈이 동그래졌어요. 그때였어요. “저기 책상 위를 보라옹.” 동네 산책을 나갔던 몽몽이가 어느새 돌아와 창가에서 졸린 눈을 비비며 박사님의 책상을 가리켰어요.",박사님은 왜 도쿄로 출장을 가셨나요?,전 세계 과학자들이 모이는 세미나에 참석하려고,PT03,83.0,2.6153846153846154,4.0,361.0,1,4
43861,"그런데 뒤를 돌아보니 몽몽이가 졸졸 따라오고 있었어요. 투덜이가 퉁명스럽게 쏘아붙였어요. “몽몽아, 넌 왜 따라오는 거야? 귀찮게!” 몽몽이는 볼멘소리로 툴툴댔어요. “왜 나만 미워하냐옹?” “내가 언제?” 사실 투덜이는 몽몽이 때문에 조금 기분이 상했어요. 어제 투덜이가 연구소에서 고양이 참치 캔을 사람 것인 줄 알고 다 먹어치웠어요. 그러자 몽몽이가 펄펄 뛰었고, 박사님이 ‘왜 고양이 간식을 먹냐!’며 투덜이를 나무랐어요. 투덜이는 몽몽이 때문에 야단맞은 게 화가 나 어제부터 몽몽이만 보면 퉁명스럽게 대했어요.",투덜이가 몽몽이 때문에 기분이 상한 이유는 무엇인가요?,투덜이가 몽몽이 때문에 야단맞은 게 화가 났기 때문이에요.,PT03,66.0,1.7272727272727273,4.0,290.0,1,4
43866,"대원들은 박쥐를 비롯한 동굴 생물들이 놀라지 않도록 작은 목소리로 말했어요. “선생님, 저기 바닥에 있는 게 석순이에요?” “맞아. 종유석은 동굴 천장에서 자라고 석순은 바닥에서 자라. 종유석과 석순이 만나 기둥이 된 건 석주라고 하지.” 탐험로를 따라 안쪽으로 들어갈수록 동굴도 넓어지고 종유석 모양도 다양해졌어요. 순간 유비가 깜짝 놀랐어요. “앗, 뭐가 움직였어!” “나도 봤어. 이상하게 생긴 벌레였어.” 그러자 선생님이 동굴 곤충에 대해 설명해 주었어요. “동굴에 사는 곤충들은 어두워서 눈이 퇴화된 대신 더듬이가 발달했어. 그래서 아주 재빠르게 움직이지.”",뭔가 이상하게 생긴 벌레를 본 유비는 기분이 어땠을까요?,어두운데 너무 재빨라서 깜짝 놀랐어요.,PT03,73.0,3.4285714285714284,5.0,317.0,1,4
43874,"바로 그때, 아까부터 안절부절못하고 있던 투덜이가 앞으로 성큼 나서며 소리쳤어요. “우리 몽몽이는 내가 구할 거야!” 투덜이는 돌 위에 두 손을 올려놓더니 온 힘을 다해 밀며 기합을 넣었어요. “이야야얍!” 투덜이의 기합 소리가 동굴에 깊게 울려 퍼졌어요. 그런데 이게 웬일인가요! 꿈쩍도 하지 않던 큰 돌이 약간 옆으로 밀려나 몽몽이가 빠져 나올 충분한 틈이 생겼어요! 유비가 소리쳤어요. “투덜이가 해냈어!” 몽몽이가 점프하여 그 틈으로 쏙 빠져나왔어요. 선생님과 대원들은 환호성을 지르며 기뻐했어요. “이제 됐어! 정말 다행이야!”","몽몽이가 빠져나오자, 선생님과 대원들의 마음은 어땠나요?",모두들 환호성을 지르며 기뻐했어요.,PT03,71.0,3.2,5.0,300.0,1,4
43875,"마리가 눈물을 흘리며 몽몽이를 와락 끌어안았어요. “으앙, 몽몽아!” 투덜이도 흙투성이 손으로 땀을 닦으며 울먹였어요. “울지 마, 마리야. 네가 우니까 나도 눈물 나잖아!” 그러자 몽몽이가 얼른 투덜이 품에 안기며 몸을 비볐어요. “구해 줘서 고맙다옹! 투덜이가 최고다옹!” 그때 유비가 투덜이를 슬쩍 건드리며 물었어요. “몽몽이한테 삐진 거 다 풀렸어?” 투덜이가 몽몽이를 안은 채 말했어요. “삐진 적 없어! 그리고 앞으로 몽몽이 간식은 내가 챙겨줄 거야! 참치 캔도 절대 안 빼앗아 먹을 거야!” 유비와 마리가 킥킥 웃자 6학년 누나가 어깨를 으쓱하며 이렇게 말했어요. “오늘 동굴 탐험은 정말 엄청났어! 박쥐 떼의 습격에, 고양이 구출까지! 아마 평생 잊지 못할 거야!” 그 말에 선생님과 대원들이 모두 웃음을 터뜨렸어요.",마리는 어떤 기분이었을까요?,몽몽이를 볼 수 있어서 안심했을 것 같아요.,PT03,100.0,2.5,5.0,409.0,1,4
43860,"“드디어 동굴 탐험을 떠난다!” 토요일 아침, 삼총사는 학교 가는 날보다 일찍 일어나 연구소에 모였어요. 연구소에 있는 동굴 탐험 장비를 챙기기 위해서였어요. 삼총사는 학교의 동굴 탐험 동아리에 속해 있었어요. 그런데 이번 주말에 청룡산에 있는 청룡 동굴로 탐험을 떠나게 되었어요. 마침 담임 선생님이 인솔을 맡았고, 4, 5, 6학년 형과 누나들도 같이 가는 거라서 삼총사는 더더욱 기대가 되었어요. “손전등 챙겼지? 모자도?” “응! 헤드 랜턴이랑 밧줄, 배낭도!” “꼭 밀림을 탐험하는 과학자가 된 기분이야!” 삼총사는 들떠서 급히 배낭을 둘러매고 출발을 했어요.",삼총사의 기분은 어떨까요?,기대가 되어서 기쁠 것 같아요.,PT03,76.0,1.875,3.0,318.0,1,4
43867,"투덜이가 갑자기 선생님에게 물었어요. “선생님, 이 동굴에 박쥐는 없나요?” 그 말에 4학년 누나가 조그맣게 중얼거렸어요. “박쥐 떼가 날아오면 정말 무서울 거야.” 6학년 형도 숨을 죽이며 작게 말했어요. “쥐도 무서운데 박쥐는 더 무섭겠다.” 모두들 박쥐 이야기를 하자 선생님이 설명해 주었어요. “이 동굴 깊은 곳엔 박쥐가 살아. 하지만 지금은 낮이라 활동을 안 하고 잠자고 있어. 깨우지 않도록 조심하자.” 투덜이는 박쥐가 자고 있다는 말에 뭔가 아쉬웠어요. “박쥐를 만나면 배트맨이 된 기분일 텐데.” 투덜이는 아쉬운 마음에 손에 들고 있던 작은 돌멩이를 동굴 안쪽을 향해 휙 던졌어요.",투덜이는 박쥐가 자고 있다는 말에 기분이 어땠나요?,박쥐를 직접 보지 못해서 뭔가 좀 아쉬웠어요.,PT03,82.0,2.875,7.0,333.0,1,4
43868,"삼총사 곁에 있던 몽몽이가 갑자기 두리번거렸어요. “이상한 소리가 난다옹.” 처음엔 아무 소리도 안 들렸는데 조금 있으니까 정말로 웅웅거리는 소리가 들리기 시작했어요. ‘푸다다닥’ 동굴 속 어두운 곳에서 점점 큰 소리가 들려왔어요. “으악, 박쥐 떼다!” 새까만 박쥐 떼가 대원들 쪽으로 날아오고 있었어요! 선생님이 외쳤어요. “얘들아, 입구 쪽으로 도망쳐!” 대원들은 재빨리 돌아서서 선생님의 인도하에 입구 방향으로 도망쳤어요. 삼총사도 머리를 감싸 쥐고 조심히 도망쳤어요. 하지만 박쥐들이 이리저리 날아다니자 당황해서 서로 부딪치기도 하고 넘어지기도 했어요. 우왕좌왕하는 대원들을 선생님이 붙잡아 주었어요.",박쥐들이 이리저리 날아다니자 당황한 대원들은 어떻게 했나요?,입구 방향으로 도망치면서 서로 부딪치기도 하고 넘어지기도 했어요.,PT03,75.0,2.4444444444444446,3.0,341.0,1,4
43871,"선생님은 다른 대원들은 밖에서 기다리라고 하고 삼총사와 함께 다시 동굴 안으로 들어갔어요. “몽몽아, 어디 있니?” 마리가 애타게 몽몽이를 불렀어요. 잠시 후, 어디선가 ‘야옹~’ 하는 소리가 들려왔어요. 삼총사는 너무 반가워 소리가 난 곳으로 다가갔어요. “몽몽아, 뭐하고 있어? 어서 나와!” “나도 나가고 싶다옹. 근데 큰 돌이 입구를 막고 있다옹.” 몽몽이가 빠진 웅덩이 위에는 정말 큰 돌이 막혀 있었어요. 옆에 몽몽이가 빠진 작은 틈이 있었지만 혼자서는 나오기가 힘든 구조였어요.",몽몽이가 빠진 곳은 어떤 곳이었나요?,큰 돌이 입구를 막고 있어서 혼자서는 나오기가 힘든 구조였어요.,PT03,66.0,2.5,6.0,274.0,1,4
44405,수업이 끝난 후 마리가 유비와 투덜이의 자리로 건너왔어요. 그런데 이게 웬일인가요? 투덜이는 심한 감기라도 걸린 것처럼 부들부들 떨고 있었어요. “너 왜 그래?” “어디 아프니?” 유비와 마리가 묻자 투덜이가 떨리는 목소리로 말했어요. “태양이 죽으면 우리도 다 죽을 거 아냐. 정말 너무너무 무섭다!” 투덜이는 주변을 둘러보았어요. 다른 아이들은 어떤지 확인해 보려고요. 그런데 다른 아이들은 평소와 다름없이 다들 장난을 치며 놀고 있었어요. 투덜이처럼 무서워하는 친구는 아무도 없었어요.,누가 평소와 다름없이 장난을 치며 놀고 있었나요?,다른 아이들은 장난을 치며 놀고 있었어요.,PT03,64.0,2.4285714285714284,4.0,274.0,1,4
44410,"그날 투덜이는 저녁도 먹는 둥 마는 둥 하고 일찌감치 자리에 누웠어요. 자리에 누웠는데도 잠이 잘 오지 않았어요. 그러다가 어느 순간 까무룩 잠이 들었는데 엄청나게 무서운 꿈을 꾸었어요. 갑자기 태양이 콰콰쾅! 폭발하여 사방으로 흩어지는 꿈이었어요. 태양이 사라지자 지구는 캄캄해졌고 순식간에 빙하기 같은 겨울이 찾아왔어요. 너무 추워 모든 생물이 꽁꽁 얼어 하나둘 죽어갔어요. 덜덜 떨던 투덜이도 조금씩 얼음으로 변해갔어요. “으, 으악!” 투덜이는 비명을 지르며 꿈에서 깨어났어요. ‘휴, 꿈이었어!’ 그 뒤로 투덜이는 잠도 못 자고 이리저리 뒤척거리다 아침을 맞았어요.",누가 까무룩 잠이 들어 엄청나게 무서운 꿈을 꾸었나요?,투덜이가 꿈을 꾸었어요.,PT03,76.0,2.4285714285714284,3.0,321.0,1,4
44408,"유비와 마리는 투덜이를 위로해 주려고 이런저런 말을 생각해 보았어요. 하지만 좋은 말이 잘 떠오르지 않아 결국 이렇게 말했어요. “투덜아, 너무 걱정 마.” “그래, 태양이 식을까 봐 걱정하는 건 뭔가 잘못된 생각 같아.” 투덜이는 우울한 표정으로 유비와 마리를 멀거니 쳐다보았어요. 그러고는 낮은 목소리로 말했어요. “그래 잘 알았어. 오늘은 나 혼자 생각해 볼 게 좀 있어. 먼저 갈게.” 투덜이는 책가방을 들고 바로 집으로 가 버렸어요.",우울한 표정으로 누가 유비와 마리를 멀거니 쳐다보았나요?,투덜이가 멀거니 쳐다보았어요.,PT03,63.0,2.7857142857142856,6.0,247.0,1,4
44405,수업이 끝난 후 마리가 유비와 투덜이의 자리로 건너왔어요. 그런데 이게 웬일인가요? 투덜이는 심한 감기라도 걸린 것처럼 부들부들 떨고 있었어요. “너 왜 그래?” “어디 아프니?” 유비와 마리가 묻자 투덜이가 떨리는 목소리로 말했어요. “태양이 죽으면 우리도 다 죽을 거 아냐. 정말 너무너무 무섭다!” 투덜이는 주변을 둘러보았어요. 다른 아이들은 어떤지 확인해 보려고요. 그런데 다른 아이들은 평소와 다름없이 다들 장난을 치며 놀고 있었어요. 투덜이처럼 무서워하는 친구는 아무도 없었어요.,투덜이가 무섭다고 한 이유가 무엇일까요?,태양이 죽으면 우리도 다 죽을 거라는 생각에 무서웠어요.,PT03,64.0,2.4285714285714284,4.0,274.0,1,4
44403,"과학 시간에 선생님이 태양에 대해 설명하고 있는데, 투덜이는 꾸벅꾸벅 졸고 있었어요. “태양은 정말 대단히 중요해. 태양에서 나오는 에너지의 힘으로 지구에 사는 생명체가 모두 살아가고 있으니까 말이야.” 그때 투덜이 짝인 유비가 손을 들고 물었어요. “그럼 태양이 없어지면 사람들은 모두 죽나요?” “물론이지. 태양이 없어지면 식물들이 자라지 못해 죽게 되고, 그럼 식물을 먹는 초식 동물은 물론 육식 동물과 사람도 모두 죽게 된단다.” “우와, 진짜 무섭다!” 반 아이들이 한꺼번에 소리를 질렀어요. 그 바람에 졸던 투덜이도 정신이 번쩍 들었어요.",졸고 있던 투덜이가 정신이 번쩍 든 이유가 무엇일까요?,반 아이들이 한꺼번에 소리를 질렀기 때문이에요.,PT03,74.0,2.0,4.0,307.0,1,4
44708,"마리가 유비를 보며 이어서 말했어요. “게다가 안전띠와 안전장치가 있으니까 너 혼자 떨어질 일은 없을 거야. 이제 겁 안 나지?” “그, 그래! 원운동과 구심력! 그런 거지! 나도 원래 알고 있었는데 잠깐 까먹었어.” 유비는 어색하게 ‘하하!’하고 웃었어요. 마리가 다시 물었어요. “이제 원리를 알고 나니까 하나도 겁 안 나지?” “야! 원래 겁난 거 아니라니까! 사실은 너희가 원심력과 구심력에 대해 알고 있나 보려고 그랬지. 하하하!” 그러자 마리가 킥킥 웃었어요. “그럼 다행이네. 이제 우리가 탈 차례니까!” 어느덧 줄은 쑥쑥 줄어들어 삼총사의 차례가 왔어요.",유비는 왜 어색하게 웃었나요?,겁이 나서 타지 않으려고 하는 마음을 들킨 것 같아서요.,PT03,78.0,2.8181818181818183,5.0,318.0,1,4
